post_id,tag_id,title,content,date_published,status
1043,12,Phasellus dapibus,"aliquet, metus urna convallis erat, eget tincidunt dui augue eu tellus. Phasellus elit pede, malesuada vel, venenatis vel,",3/3/2024 4:02,Published
1387,7,ac metus,"In mi pede, nonummy ut, molestie in, tempus eu, ligula. Aenean euismod mauris eu elit. Nulla facilisi.",12/14/2023 19:59,Draft
1332,6,"lorem, auctor","ut erat. Sed nunc est, mollis non, cursus non, egestas a, dui. Cras pellentesque. Sed dictum. Proin eget odio. Aliquam vulputate ullamcorper",9/20/2023 8:27,Draft
1368,27,non quam.,"enim. Etiam gravida molestie arcu. Sed eu nibh vulputate mauris sagittis placerat. Cras dictum ultricies ligula. Nullam enim. Sed nulla ante,",11/15/2023 14:38,Published
1091,22,"est mauris,","Phasellus dolor elit, pellentesque a, facilisis non, bibendum sed, est. Nunc laoreet lectus quis",8/21/2023 9:12,Draft
1306,28,"in, tempus",Fusce aliquet magna a neque. Nullam ut nisi a odio semper cursus. Integer mollis. Integer tincidunt aliquam arcu.,6/30/2023 15:55,Draft
1247,36,ipsum primis,"egestas blandit. Nam nulla magna, malesuada vel, convallis in, cursus et, eros. Proin ultrices. Duis volutpat nunc sit amet metus. Aliquam",5/1/2024 12:59,Draft
1229,6,eget metus.,"iaculis aliquet diam. Sed diam lorem, auctor quis, tristique ac, eleifend vitae, erat. Vivamus nisi. Mauris nulla.",3/26/2024 21:10,Published
1032,31,Aliquam ultrices,Proin sed turpis nec mauris blandit mattis. Cras eget nisi dictum augue malesuada malesuada.,7/24/2023 3:37,Draft
1125,37,eu sem.,et ipsum cursus vestibulum. Mauris magna. Duis dignissim tempor arcu. Vestibulum ut eros non enim commodo hendrerit. Donec,11/10/2023 1:14,Published
1302,1,ipsum. Curabitur,Sed dictum. Proin eget odio. Aliquam vulputate ullamcorper magna. Sed eu eros. Nam consequat dolor vitae dolor. Donec fringilla. Donec feugiat metus sit amet,10/26/2023 16:06,Published
1074,30,interdum. Sed,"ac ipsum. Phasellus vitae mauris sit amet lorem semper auctor. Mauris vel turpis. Aliquam adipiscing lobortis risus. In mi pede, nonummy ut, molestie",8/19/2023 16:48,Draft
1363,2,tempor arcu.,"id ante dictum cursus. Nunc mauris elit, dictum eu, eleifend nec, malesuada ut,",6/14/2023 19:00,Published
1302,17,"neque tellus,","Nam nulla magna, malesuada vel, convallis in, cursus et, eros. Proin ultrices. Duis volutpat nunc sit",12/12/2023 11:05,Draft
1257,22,erat. Sed,"vitae risus. Duis a mi fringilla mi lacinia mattis. Integer eu lacus. Quisque imperdiet, erat nonummy ultricies ornare, elit elit fermentum risus, at",2/15/2024 15:04,Draft
1325,15,"sit amet,","at lacus. Quisque purus sapien, gravida non, sollicitudin a, malesuada id, erat. Etiam",8/19/2023 7:41,Published
1166,25,ut mi.,"ac turpis egestas. Aliquam fringilla cursus purus. Nullam scelerisque neque sed sem egestas blandit. Nam nulla magna, malesuada vel, convallis in, cursus et, eros. Proin",9/23/2023 9:12,Published
1051,24,ut aliquam,"Fusce aliquam, enim nec tempus scelerisque, lorem ipsum sodales purus, in molestie tortor nibh sit amet orci. Ut sagittis",2/25/2024 2:02,Draft
1003,22,mollis. Integer,"fermentum vel, mauris. Integer sem elit, pharetra ut, pharetra sed, hendrerit a,",8/6/2023 18:21,Draft
1139,5,urna. Vivamus,et netus et malesuada fames ac turpis egestas. Aliquam fringilla cursus purus. Nullam scelerisque neque sed,12/6/2023 14:50,Published
1368,24,Suspendisse non,"placerat, augue. Sed molestie. Sed id risus quis diam luctus lobortis. Class aptent taciti sociosqu",12/30/2023 13:54,Published
1112,30,faucibus orci,"eget mollis lectus pede et risus. Quisque libero lacus, varius et, euismod et, commodo at, libero. Morbi accumsan laoreet ipsum. Curabitur consequat, lectus sit amet",1/22/2024 2:56,Published
1074,21,Aenean gravida,"augue porttitor interdum. Sed auctor odio a purus. Duis elementum, dui quis accumsan convallis,",8/20/2023 4:22,Draft
1170,8,luctus felis,interdum. Curabitur dictum. Phasellus in felis. Nulla tempor augue ac ipsum. Phasellus vitae mauris sit amet lorem semper auctor. Mauris vel turpis. Aliquam,8/11/2023 1:52,Draft
1158,30,lorem fringilla,"non magna. Nam ligula elit, pretium et, rutrum non, hendrerit id, ante. Nunc mauris sapien, cursus",5/26/2023 6:25,Draft
