post_id,tag_id,title,content,date_published,status
1373,11,Mauris ut,"arcu. Curabitur ut odio vel est tempor bibendum. Donec felis orci, adipiscing non, luctus sit amet, faucibus",10/22/2023 14:49,Draft
1340,15,Morbi non,"Suspendisse aliquet molestie tellus. Aenean egestas hendrerit neque. In ornare sagittis felis. Donec tempor, est ac mattis semper, dui",12/5/2023 15:51,Draft
1014,32,"elit, pharetra","risus. In mi pede, nonummy ut, molestie in, tempus eu, ligula. Aenean euismod mauris eu elit. Nulla facilisi. Sed neque. Sed eget lacus.",12/11/2023 16:53,Published
1188,30,"at, libero.",ut eros non enim commodo hendrerit. Donec porttitor tellus non magna.,12/24/2023 21:19,Draft
1242,24,odio a,Donec dignissim magna a tortor. Nunc commodo auctor velit. Aliquam nisl. Nulla eu neque pellentesque massa lobortis,8/25/2023 3:20,Draft
1075,19,laoreet lectus,"arcu iaculis enim, sit amet ornare lectus justo eu arcu. Morbi sit amet",4/26/2024 0:04,Draft
1049,22,Fusce dolor,"nec, cursus a, enim. Suspendisse aliquet, sem ut cursus luctus, ipsum",12/3/2023 20:16,Published
1300,25,quam quis,"enim. Etiam imperdiet dictum magna. Ut tincidunt orci quis lectus. Nullam suscipit, est ac facilisis facilisis, magna",2/22/2024 14:18,Published
1145,4,"sit amet,","diam eu dolor egestas rhoncus. Proin nisl sem, consequat nec, mollis vitae, posuere at, velit. Cras",8/13/2023 8:13,Draft
1097,33,natoque penatibus,"blandit viverra. Donec tempus, lorem fringilla ornare placerat, orci lacus vestibulum lorem, sit amet ultricies sem",3/24/2024 18:10,Draft
1227,8,aliquet libero.,lobortis mauris. Suspendisse aliquet molestie tellus. Aenean egestas hendrerit neque. In ornare,8/12/2023 11:51,Draft
1235,38,lorem ac,"Proin non massa non ante bibendum ullamcorper. Duis cursus, diam at pretium aliquet, metus urna convallis erat, eget tincidunt dui augue eu tellus.",12/15/2023 18:03,Published
1105,8,lacus. Quisque,ornare lectus justo eu arcu. Morbi sit amet massa. Quisque porttitor,1/21/2024 6:35,Published
1039,30,nisi sem,"lectus justo eu arcu. Morbi sit amet massa. Quisque porttitor eros nec tellus. Nunc lectus pede, ultrices a, auctor non, feugiat nec, diam. Duis",12/7/2023 12:48,Published
1211,27,lacus. Ut,"Phasellus elit pede, malesuada vel, venenatis vel, faucibus id, libero. Donec consectetuer mauris id sapien. Cras dolor",7/23/2023 1:21,Published
1387,25,diam eu,"placerat eget, venenatis a, magna. Lorem ipsum dolor sit amet, consectetuer adipiscing elit. Etiam laoreet, libero et tristique pellentesque, tellus",2/25/2024 19:41,Published
1148,11,pede blandit,"tempus non, lacinia at, iaculis quis, pede. Praesent eu dui. Cum sociis natoque penatibus et magnis dis parturient montes, nascetur ridiculus mus. Aenean",3/11/2024 7:12,Published
1121,12,dignissim. Maecenas,Praesent luctus. Curabitur egestas nunc sed libero. Proin sed turpis nec mauris blandit mattis. Cras eget nisi dictum,4/30/2024 9:06,Draft
1111,19,"urna, nec","Cum sociis natoque penatibus et magnis dis parturient montes, nascetur ridiculus mus. Proin vel arcu",6/9/2023 20:21,Published
1171,23,vitae risus.,nascetur ridiculus mus. Proin vel arcu eu odio tristique pharetra. Quisque ac,10/10/2023 17:07,Published
1122,26,non magna.,"gravida mauris ut mi. Duis risus odio, auctor vitae, aliquet nec, imperdiet nec, leo. Morbi",5/22/2023 3:48,Published
1244,21,eu tellus.,ipsum. Donec sollicitudin adipiscing ligula. Aenean gravida nunc sed pede. Cum sociis natoque penatibus et magnis dis parturient,7/22/2023 9:17,Published
1221,2,"vulputate, nisi","Nulla eget metus eu erat semper rutrum. Fusce dolor quam, elementum at, egestas a, scelerisque sed, sapien.",7/27/2023 22:25,Draft
1171,25,"convallis in,",ipsum cursus vestibulum. Mauris magna. Duis dignissim tempor arcu. Vestibulum ut eros non enim commodo hendrerit. Donec porttitor tellus non magna. Nam ligula,6/17/2023 14:25,Draft
1284,10,"Aliquam ornare,","ac facilisis facilisis, magna tellus faucibus leo, in lobortis tellus justo sit amet nulla. Donec non justo. Proin",8/11/2023 12:10,Published
1398,28,Phasellus elit,"sit amet, faucibus ut, nulla. Cras eu tellus eu augue porttitor interdum. Sed auctor odio a purus. Duis elementum, dui quis accumsan",7/27/2023 11:38,Draft
1308,29,id nunc,In tincidunt congue turpis. In condimentum. Donec at arcu. Vestibulum ante ipsum primis in faucibus orci luctus et,5/13/2023 1:42,Published
1100,6,Donec egestas.,malesuada fames ac turpis egestas. Fusce aliquet magna a neque. Nullam ut nisi a odio semper cursus. Integer mollis.,7/22/2023 16:22,Draft
1270,14,odio. Phasellus,"in sodales elit erat vitae risus. Duis a mi fringilla mi lacinia mattis. Integer eu lacus. Quisque imperdiet,",11/1/2023 21:33,Draft
1078,10,"vulputate, nisi","ornare tortor at risus. Nunc ac sem ut dolor dapibus gravida. Aliquam tincidunt, nunc ac mattis ornare, lectus ante dictum mi, ac mattis velit justo",5/20/2023 4:06,Draft
1152,5,"varius et,",diam. Pellentesque habitant morbi tristique senectus et netus et malesuada fames ac turpis egestas. Fusce,7/9/2023 18:20,Draft
1342,15,enim. Curabitur,"dis parturient montes, nascetur ridiculus mus. Proin vel nisl. Quisque fringilla euismod enim. Etiam gravida molestie arcu. Sed eu nibh vulputate",5/25/2023 16:03,Published
1383,33,nec urna,vulputate ullamcorper magna. Sed eu eros. Nam consequat dolor vitae dolor. Donec,4/15/2024 0:44,Draft
1049,33,lectus sit,porttitor scelerisque neque. Nullam nisl. Maecenas malesuada fringilla est. Mauris eu turpis. Nulla aliquet. Proin,4/12/2024 14:05,Published
1317,30,cursus. Integer,nisi. Aenean eget metus. In nec orci. Donec nibh. Quisque nonummy ipsum non,4/26/2024 1:53,Draft
1009,33,libero at,"in sodales elit erat vitae risus. Duis a mi fringilla mi lacinia mattis. Integer eu lacus. Quisque imperdiet, erat nonummy ultricies ornare, elit elit",9/9/2023 9:59,Draft
1088,15,"enim, condimentum","vel, venenatis vel, faucibus id, libero. Donec consectetuer mauris id sapien. Cras dolor dolor, tempus",8/15/2023 9:59,Published
1002,34,"nostra, per","dignissim magna a tortor. Nunc commodo auctor velit. Aliquam nisl. Nulla eu neque pellentesque massa lobortis ultrices. Vivamus rhoncus. Donec est. Nunc ullamcorper, velit in",11/10/2023 8:01,Draft
1101,26,interdum. Sed,"eleifend non, dapibus rutrum, justo. Praesent luctus. Curabitur egestas nunc sed libero. Proin sed turpis",3/29/2024 7:15,Published
1220,18,mauris a,Donec dignissim magna a tortor. Nunc commodo auctor velit. Aliquam nisl. Nulla eu neque pellentesque massa lobortis ultrices. Vivamus,3/24/2024 5:35,Published
1103,35,venenatis lacus.,"montes, nascetur ridiculus mus. Proin vel arcu eu odio tristique pharetra. Quisque ac libero nec ligula consectetuer rhoncus. Nullam velit",1/25/2024 6:56,Draft
1008,10,Nam ac,"Cras vulputate velit eu sem. Pellentesque ut ipsum ac mi eleifend egestas. Sed pharetra, felis eget varius ultrices, mauris ipsum porta elit, a",10/6/2023 15:35,Published
1272,25,"adipiscing fringilla,",erat eget ipsum. Suspendisse sagittis. Nullam vitae diam. Proin dolor. Nulla semper tellus id nunc interdum feugiat. Sed,4/7/2024 8:26,Draft
1345,10,risus. Nulla,"risus. Donec egestas. Aliquam nec enim. Nunc ut erat. Sed nunc est, mollis non,",9/25/2023 21:28,Draft
1356,8,adipiscing ligula.,"lorem, eget mollis lectus pede et risus. Quisque libero lacus, varius et, euismod et, commodo at,",9/9/2023 6:23,Published
1095,18,"sit amet,","Nulla facilisis. Suspendisse commodo tincidunt nibh. Phasellus nulla. Integer vulputate, risus a ultricies adipiscing, enim mi tempor",4/4/2024 9:39,Draft
1175,21,eros nec,"sed, facilisis vitae, orci. Phasellus dapibus quam quis diam. Pellentesque habitant morbi tristique",6/5/2023 15:34,Draft
1213,38,Aenean egestas,"sem semper erat, in consectetuer ipsum nunc id enim. Curabitur massa. Vestibulum accumsan neque et",3/9/2024 9:33,Draft
1228,20,habitant morbi,"eu dolor egestas rhoncus. Proin nisl sem, consequat nec, mollis vitae, posuere",3/21/2024 9:12,Published
1005,3,Cras vehicula,quam. Pellentesque habitant morbi tristique senectus et netus et malesuada fames ac turpis egestas. Aliquam fringilla,10/22/2023 10:26,Published
1037,20,Fusce aliquet,"metus vitae velit egestas lacinia. Sed congue, elit sed consequat auctor, nunc nulla vulputate dui, nec tempus mauris erat eget ipsum. Suspendisse",8/29/2023 19:27,Published
1222,32,auctor. Mauris,"risus odio, auctor vitae, aliquet nec, imperdiet nec, leo. Morbi neque tellus, imperdiet non, vestibulum nec, euismod",10/27/2023 5:39,Published
1134,30,rutrum lorem,"iaculis, lacus pede sagittis augue, eu tempor erat neque non quam.",9/4/2023 19:49,Published
1074,30,vel est,"egestas blandit. Nam nulla magna, malesuada vel, convallis in, cursus et, eros.",10/12/2023 1:19,Draft
1223,9,"purus, accumsan","adipiscing. Mauris molestie pharetra nibh. Aliquam ornare, libero at auctor ullamcorper, nisl arcu iaculis enim, sit amet ornare lectus justo eu arcu. Morbi sit amet",9/25/2023 10:03,Published
1199,21,"vitae, posuere","ultrices, mauris ipsum porta elit, a feugiat tellus lorem eu metus. In lorem. Donec elementum, lorem ut",11/7/2023 5:05,Published
1120,31,congue turpis.,"tincidunt, nunc ac mattis ornare, lectus ante dictum mi, ac mattis velit justo nec ante. Maecenas mi felis, adipiscing fringilla,",11/17/2023 20:46,Draft
1359,22,Nulla eget,tempor augue ac ipsum. Phasellus vitae mauris sit amet lorem semper auctor. Mauris vel,10/10/2023 14:31,Published
1259,29,luctus aliquet,mauris erat eget ipsum. Suspendisse sagittis. Nullam vitae diam. Proin dolor. Nulla semper tellus id nunc interdum feugiat. Sed nec,6/10/2023 21:41,Draft
1273,5,tincidunt. Donec,"mauris id sapien. Cras dolor dolor, tempus non, lacinia at, iaculis quis, pede. Praesent eu dui. Cum sociis natoque penatibus et",10/26/2023 18:31,Published
1082,7,"ullamcorper, nisl",dignissim tempor arcu. Vestibulum ut eros non enim commodo hendrerit. Donec porttitor,3/16/2024 6:45,Draft
1031,24,eget mollis,"porttitor interdum. Sed auctor odio a purus. Duis elementum, dui quis accumsan convallis, ante lectus",1/1/2024 20:48,Draft
1368,32,Sed neque.,"vel, vulputate eu, odio. Phasellus at augue id ante dictum cursus. Nunc mauris elit, dictum eu, eleifend",5/15/2023 22:37,Draft
1160,22,sagittis. Nullam,"eu, ultrices sit amet, risus. Donec nibh enim, gravida sit amet, dapibus id, blandit at, nisi. Cum sociis natoque penatibus et",12/4/2023 3:19,Draft
1371,7,auctor velit.,"risus. Morbi metus. Vivamus euismod urna. Nullam lobortis quam a felis ullamcorper viverra. Maecenas iaculis aliquet diam. Sed diam lorem, auctor quis,",9/23/2023 5:58,Draft
1360,26,erat volutpat.,pharetra. Nam ac nulla. In tincidunt congue turpis. In condimentum. Donec at arcu. Vestibulum ante ipsum primis in faucibus,5/28/2023 4:03,Published
1070,4,eu neque,at fringilla purus mauris a nunc. In at pede. Cras vulputate velit eu sem.,4/5/2024 23:49,Published
1349,17,neque. Nullam,nisl. Quisque fringilla euismod enim. Etiam gravida molestie arcu. Sed eu nibh vulputate mauris sagittis placerat. Cras dictum ultricies ligula.,11/1/2023 16:16,Published
1089,29,est tempor,aliquam arcu. Aliquam ultrices iaculis odio. Nam interdum enim non nisi. Aenean eget metus. In nec,6/18/2023 2:44,Published
1102,25,Aenean massa.,"vitae odio sagittis semper. Nam tempor diam dictum sapien. Aenean massa. Integer vitae nibh. Donec est mauris, rhoncus id, mollis",11/2/2023 14:12,Draft
1185,36,orci tincidunt,"magna. Lorem ipsum dolor sit amet, consectetuer adipiscing elit. Etiam laoreet, libero et tristique",9/1/2023 6:53,Draft
1237,28,Duis gravida.,"In mi pede, nonummy ut, molestie in, tempus eu, ligula. Aenean euismod mauris eu elit. Nulla facilisi. Sed",8/2/2023 16:54,Draft
1390,38,lorem ac,"libero et tristique pellentesque, tellus sem mollis dui, in sodales elit erat vitae risus. Duis a",9/10/2023 15:21,Published
1340,18,fermentum arcu.,"erat. Sed nunc est, mollis non, cursus non, egestas a, dui. Cras pellentesque. Sed dictum. Proin eget odio. Aliquam",8/9/2023 7:59,Published
1288,22,Aliquam adipiscing,"orci, adipiscing non, luctus sit amet, faucibus ut, nulla. Cras eu tellus eu augue porttitor interdum. Sed auctor odio a purus. Duis elementum, dui",7/20/2023 8:06,Published
1060,35,"convallis in,","tellus lorem eu metus. In lorem. Donec elementum, lorem ut aliquam iaculis, lacus pede",5/24/2023 12:29,Draft
1336,3,diam. Pellentesque,"sapien. Aenean massa. Integer vitae nibh. Donec est mauris, rhoncus id,",7/21/2023 1:36,Published
1244,38,Curae Phasellus,"bibendum fermentum metus. Aenean sed pede nec ante blandit viverra. Donec tempus, lorem fringilla ornare placerat, orci lacus vestibulum",2/16/2024 22:42,Draft
1364,17,"hendrerit id,","nec, euismod in, dolor. Fusce feugiat. Lorem ipsum dolor sit amet, consectetuer adipiscing elit.",11/29/2023 9:36,Published
1322,13,arcu ac,"felis purus ac tellus. Suspendisse sed dolor. Fusce mi lorem, vehicula et, rutrum eu, ultrices sit amet, risus. Donec nibh enim,",10/22/2023 14:40,Draft
1341,21,enim. Sed,"placerat. Cras dictum ultricies ligula. Nullam enim. Sed nulla ante, iaculis nec, eleifend non, dapibus rutrum, justo. Praesent luctus. Curabitur egestas",2/19/2024 19:02,Published
1106,32,erat. Etiam,dictum. Phasellus in felis. Nulla tempor augue ac ipsum. Phasellus vitae mauris sit amet lorem semper auctor.,1/31/2024 22:32,Draft
1182,24,eu arcu.,faucibus orci luctus et ultrices posuere cubilia Curae Phasellus ornare. Fusce mollis. Duis sit amet diam,4/10/2024 19:50,Draft
1392,11,volutpat. Nulla,"eu, euismod ac, fermentum vel, mauris. Integer sem elit, pharetra ut, pharetra sed, hendrerit a, arcu. Sed et libero. Proin mi. Aliquam gravida mauris",1/28/2024 6:18,Published
1163,16,sapien. Aenean,"Maecenas iaculis aliquet diam. Sed diam lorem, auctor quis, tristique",9/7/2023 8:57,Published
1366,34,vitae risus.,"ut cursus luctus, ipsum leo elementum sem, vitae aliquam eros turpis non enim. Mauris",8/19/2023 9:21,Published
1109,12,urna convallis,pretium neque. Morbi quis urna. Nunc quis arcu vel quam dignissim pharetra. Nam ac nulla. In tincidunt congue turpis. In condimentum.,11/23/2023 7:46,Draft
1330,24,Aliquam adipiscing,magna a neque. Nullam ut nisi a odio semper cursus. Integer mollis. Integer tincidunt aliquam arcu. Aliquam,6/16/2023 8:15,Draft
1047,26,Nulla facilisi.,"Aenean eget magna. Suspendisse tristique neque venenatis lacus. Etiam bibendum fermentum metus. Aenean sed pede nec ante blandit viverra. Donec tempus, lorem",12/17/2023 5:42,Published
1050,16,tellus. Phasellus,"in, dolor. Fusce feugiat. Lorem ipsum dolor sit amet, consectetuer adipiscing elit. Aliquam auctor, velit eget laoreet posuere, enim nisl elementum purus, accumsan interdum",2/24/2024 3:37,Draft
1179,19,pede blandit,"tristique aliquet. Phasellus fermentum convallis ligula. Donec luctus aliquet odio. Etiam ligula tortor, dictum eu, placerat",2/3/2024 8:41,Published
1337,28,"gravida non,",consectetuer adipiscing elit. Curabitur sed tortor. Integer aliquam adipiscing lacus. Ut nec urna et arcu,10/17/2023 23:07,Draft
1348,28,"bibendum sed,",vitae aliquam eros turpis non enim. Mauris quis turpis vitae purus gravida sagittis. Duis gravida. Praesent,8/1/2023 8:51,Published
1181,32,molestie orci,"lobortis augue scelerisque mollis. Phasellus libero mauris, aliquam eu, accumsan sed, facilisis",2/26/2024 21:47,Draft
1278,22,in molestie,"quis, tristique ac, eleifend vitae, erat. Vivamus nisi. Mauris nulla. Integer urna. Vivamus molestie dapibus ligula. Aliquam",5/31/2023 2:13,Published
1213,25,"euismod et,","sagittis felis. Donec tempor, est ac mattis semper, dui lectus rutrum urna, nec luctus felis purus ac tellus. Suspendisse",10/2/2023 7:56,Published
1020,28,"faucibus id,","justo nec ante. Maecenas mi felis, adipiscing fringilla, porttitor vulputate, posuere vulputate, lacus. Cras interdum.",8/3/2023 17:23,Published
1150,21,Vivamus nibh,"nisl sem, consequat nec, mollis vitae, posuere at, velit. Cras lorem lorem,",9/30/2023 12:53,Published
1232,5,tortor nibh,"lacus pede sagittis augue, eu tempor erat neque non quam. Pellentesque habitant",4/6/2024 11:40,Draft
1330,39,turpis non,"ornare, facilisis eget, ipsum. Donec sollicitudin adipiscing ligula. Aenean gravida nunc sed pede. Cum sociis natoque penatibus et magnis dis",3/13/2024 5:01,Draft
1400,34,congue turpis.,"Aenean gravida nunc sed pede. Cum sociis natoque penatibus et magnis dis parturient montes, nascetur ridiculus mus. Proin vel arcu eu odio",9/27/2023 6:25,Draft
1210,18,Nulla facilisis.,in consectetuer ipsum nunc id enim. Curabitur massa. Vestibulum accumsan neque et nunc. Quisque,4/2/2024 6:43,Draft
1328,21,tellus justo,"vel est tempor bibendum. Donec felis orci, adipiscing non, luctus",12/31/2023 2:47,Published
1251,34,Cum sociis,"Nunc mauris. Morbi non sapien molestie orci tincidunt adipiscing. Mauris molestie pharetra nibh. Aliquam ornare, libero at auctor ullamcorper, nisl",8/6/2023 10:32,Published
1045,10,"parturient montes,","non, lacinia at, iaculis quis, pede. Praesent eu dui. Cum sociis natoque penatibus et magnis dis parturient montes, nascetur ridiculus",6/22/2023 7:53,Published
1351,15,ut dolor,"lacus, varius et, euismod et, commodo at, libero. Morbi accumsan laoreet ipsum. Curabitur consequat, lectus sit amet luctus vulputate, nisi sem semper erat, in",11/1/2023 15:40,Draft
1158,3,nec ligula,"imperdiet nec, leo. Morbi neque tellus, imperdiet non, vestibulum nec, euismod in, dolor. Fusce feugiat. Lorem ipsum dolor sit amet,",5/19/2023 19:24,Published
1016,12,Aenean sed,"magna. Phasellus dolor elit, pellentesque a, facilisis non, bibendum sed, est. Nunc laoreet lectus quis massa. Mauris vestibulum, neque sed dictum eleifend,",6/5/2023 17:51,Published
1133,5,ac orci.,Mauris nulla. Integer urna. Vivamus molestie dapibus ligula. Aliquam erat volutpat.,9/13/2023 5:24,Draft
1311,7,volutpat. Nulla,"ut ipsum ac mi eleifend egestas. Sed pharetra, felis eget varius ultrices, mauris",5/6/2023 6:04,Published
1241,34,mi fringilla,"enim diam vel arcu. Curabitur ut odio vel est tempor bibendum. Donec felis orci, adipiscing non, luctus sit amet, faucibus ut,",4/21/2024 9:15,Published
1334,9,vehicula risus.,"feugiat. Lorem ipsum dolor sit amet, consectetuer adipiscing elit. Aliquam",12/23/2023 6:40,Published
1256,5,tincidunt nibh.,"vitae, erat. Vivamus nisi. Mauris nulla. Integer urna. Vivamus molestie dapibus ligula. Aliquam erat volutpat. Nulla dignissim. Maecenas",7/20/2023 3:36,Published
1375,20,"ornare, lectus","ligula elit, pretium et, rutrum non, hendrerit id, ante. Nunc mauris sapien, cursus in,",3/16/2024 0:58,Published
1295,20,"facilisis eget,","Nam nulla magna, malesuada vel, convallis in, cursus et, eros. Proin ultrices. Duis volutpat nunc",5/12/2023 13:09,Published
1244,20,"at, nisi.","gravida non, sollicitudin a, malesuada id, erat. Etiam vestibulum massa rutrum",9/23/2023 19:24,Draft
1314,39,arcu. Sed,"cursus. Nunc mauris elit, dictum eu, eleifend nec, malesuada ut, sem. Nulla interdum. Curabitur dictum.",9/12/2023 1:22,Published
1132,2,enim. Nunc,"eu odio tristique pharetra. Quisque ac libero nec ligula consectetuer rhoncus. Nullam velit dui, semper et, lacinia vitae, sodales at, velit. Pellentesque",8/31/2023 11:40,Draft
1165,26,ipsum. Suspendisse,quis turpis vitae purus gravida sagittis. Duis gravida. Praesent eu nulla,8/4/2023 1:57,Draft
1086,19,dictum sapien.,quis urna. Nunc quis arcu vel quam dignissim pharetra. Nam ac nulla. In tincidunt congue turpis. In,9/6/2023 12:59,Published
1124,19,velit justo,"Donec elementum, lorem ut aliquam iaculis, lacus pede sagittis augue, eu tempor erat neque non",7/2/2023 13:24,Draft
1188,15,eu enim.,senectus et netus et malesuada fames ac turpis egestas. Fusce aliquet magna a neque. Nullam,11/27/2023 21:24,Published
1254,39,nascetur ridiculus,"dui, semper et, lacinia vitae, sodales at, velit. Pellentesque ultricies dignissim lacus. Aliquam rutrum lorem ac risus. Morbi metus. Vivamus",3/24/2024 3:19,Published
1041,38,neque venenatis,"pellentesque massa lobortis ultrices. Vivamus rhoncus. Donec est. Nunc ullamcorper, velit in aliquet lobortis, nisi nibh lacinia orci, consectetuer euismod est arcu",5/23/2023 19:00,Published
1197,9,Donec egestas.,"quis diam luctus lobortis. Class aptent taciti sociosqu ad litora torquent per conubia nostra, per inceptos hymenaeos. Mauris",3/3/2024 8:41,Published
1225,20,interdum ligula,"Nunc pulvinar arcu et pede. Nunc sed orci lobortis augue scelerisque mollis. Phasellus libero mauris, aliquam eu, accumsan",2/26/2024 19:55,Draft
1014,31,cursus vestibulum.,"auctor ullamcorper, nisl arcu iaculis enim, sit amet ornare lectus justo eu arcu. Morbi sit amet massa. Quisque",7/19/2023 18:04,Published
1263,33,velit. Aliquam,"Mauris vestibulum, neque sed dictum eleifend, nunc risus varius orci, in consequat enim diam vel arcu. Curabitur ut odio vel est tempor bibendum. Donec",4/9/2024 15:04,Published
1080,9,"sagittis augue,",arcu. Vestibulum ante ipsum primis in faucibus orci luctus et ultrices,3/7/2024 11:10,Draft
1034,22,sem molestie,"eu, accumsan sed, facilisis vitae, orci. Phasellus dapibus quam quis diam. Pellentesque habitant morbi",7/16/2023 18:06,Published
1018,26,Donec nibh,"pharetra. Quisque ac libero nec ligula consectetuer rhoncus. Nullam velit dui, semper",12/1/2023 2:53,Published
1239,23,iaculis odio.,"rhoncus. Donec est. Nunc ullamcorper, velit in aliquet lobortis, nisi nibh lacinia orci, consectetuer euismod est arcu ac orci.",11/30/2023 3:05,Published
1141,36,magna tellus,vel pede blandit congue. In scelerisque scelerisque dui. Suspendisse ac metus vitae velit egestas,9/7/2023 7:40,Published
1191,21,id sapien.,"egestas hendrerit neque. In ornare sagittis felis. Donec tempor, est ac mattis semper, dui lectus",3/25/2024 1:28,Draft
1119,2,lectus quis,"in, dolor. Fusce feugiat. Lorem ipsum dolor sit amet, consectetuer adipiscing elit. Aliquam auctor, velit eget laoreet posuere, enim nisl elementum purus, accumsan interdum libero",8/25/2023 14:12,Draft
1051,17,natoque penatibus,mauris a nunc. In at pede. Cras vulputate velit eu sem. Pellentesque ut ipsum ac mi,9/7/2023 22:50,Published
1337,13,"volutpat ornare,","dolor sit amet, consectetuer adipiscing elit. Curabitur sed tortor. Integer aliquam adipiscing lacus. Ut nec urna et arcu imperdiet ullamcorper. Duis at lacus.",8/8/2023 13:06,Published
1173,31,"ac, feugiat","vitae mauris sit amet lorem semper auctor. Mauris vel turpis. Aliquam adipiscing lobortis risus. In mi pede, nonummy ut, molestie in, tempus eu, ligula. Aenean",10/14/2023 2:41,Draft
1309,33,"est, mollis",Nam porttitor scelerisque neque. Nullam nisl. Maecenas malesuada fringilla est. Mauris eu turpis. Nulla aliquet.,2/27/2024 18:33,Published
1152,18,lectus justo,nunc id enim. Curabitur massa. Vestibulum accumsan neque et nunc. Quisque ornare tortor at,11/27/2023 7:59,Draft
1211,26,orci sem,"dui augue eu tellus. Phasellus elit pede, malesuada vel, venenatis vel, faucibus id, libero. Donec consectetuer mauris id sapien. Cras dolor dolor, tempus non, lacinia",6/8/2023 19:26,Draft
1120,4,senectus et,"sit amet, risus. Donec nibh enim, gravida sit amet, dapibus id,",2/10/2024 2:13,Draft
1006,9,at auctor,ac urna. Ut tincidunt vehicula risus. Nulla eget metus eu erat,9/10/2023 19:23,Published
1216,33,mus. Aenean,"vestibulum nec, euismod in, dolor. Fusce feugiat. Lorem ipsum dolor sit amet, consectetuer adipiscing elit. Aliquam",7/4/2023 0:59,Published
1229,30,gravida sit,"volutpat nunc sit amet metus. Aliquam erat volutpat. Nulla facilisis. Suspendisse commodo tincidunt nibh. Phasellus nulla. Integer vulputate, risus a",11/27/2023 11:18,Published
1140,31,volutpat nunc,enim. Curabitur massa. Vestibulum accumsan neque et nunc. Quisque ornare,12/12/2023 4:44,Draft
1163,37,commodo auctor,"dui lectus rutrum urna, nec luctus felis purus ac tellus. Suspendisse sed dolor. Fusce mi lorem, vehicula et, rutrum eu, ultrices sit amet, risus.",3/20/2024 6:23,Draft
1072,18,Proin mi.,"Nunc sollicitudin commodo ipsum. Suspendisse non leo. Vivamus nibh dolor, nonummy ac, feugiat non, lobortis quis, pede. Suspendisse dui. Fusce diam nunc, ullamcorper eu,",12/26/2023 6:22,Published
1378,5,metus sit,"lorem fringilla ornare placerat, orci lacus vestibulum lorem, sit amet ultricies sem magna nec quam. Curabitur vel lectus. Cum sociis natoque penatibus et magnis",3/10/2024 21:43,Draft
1227,5,interdum libero,"congue. In scelerisque scelerisque dui. Suspendisse ac metus vitae velit egestas lacinia. Sed congue,",10/6/2023 22:17,Draft
1049,29,"lorem lorem,","congue a, aliquet vel, vulputate eu, odio. Phasellus at augue id ante dictum cursus. Nunc mauris elit, dictum eu, eleifend nec, malesuada ut,",4/27/2024 4:54,Draft
1207,29,semper rutrum.,"luctus vulputate, nisi sem semper erat, in consectetuer ipsum nunc id enim. Curabitur massa. Vestibulum accumsan neque et nunc.",8/19/2023 1:30,Draft
1048,20,"ac, fermentum","magnis dis parturient montes, nascetur ridiculus mus. Donec dignissim magna a tortor. Nunc commodo auctor velit.",9/16/2023 15:30,Draft
1104,36,Nulla eu,"aliquet lobortis, nisi nibh lacinia orci, consectetuer euismod est arcu ac orci. Ut semper pretium neque. Morbi quis urna. Nunc quis arcu vel",10/1/2023 20:47,Published
1029,32,ac mattis,"eu, odio. Phasellus at augue id ante dictum cursus. Nunc mauris elit, dictum eu, eleifend nec,",9/26/2023 14:36,Published
1069,7,hymenaeos. Mauris,erat volutpat. Nulla dignissim. Maecenas ornare egestas ligula. Nullam feugiat placerat velit. Quisque varius. Nam porttitor scelerisque neque. Nullam nisl. Maecenas,12/11/2023 8:41,Draft
1053,23,cursus. Nunc,quis urna. Nunc quis arcu vel quam dignissim pharetra. Nam ac nulla.,1/12/2024 5:19,Draft
1289,16,ut quam,"viverra. Donec tempus, lorem fringilla ornare placerat, orci lacus vestibulum lorem, sit amet ultricies sem magna",8/13/2023 6:37,Published
