post_id,tag_id,title,content,date_published,status
1248,26,"egestas a,","lorem, eget mollis lectus pede et risus. Quisque libero lacus, varius et, euismod et, commodo at, libero. Morbi accumsan",7/27/2023 9:34,Draft
1065,21,vel quam,"mauris sagittis placerat. Cras dictum ultricies ligula. Nullam enim. Sed nulla ante, iaculis nec, eleifend non,",8/21/2023 7:35,Published
1238,39,est. Nunc,libero. Proin sed turpis nec mauris blandit mattis. Cras eget nisi dictum augue malesuada malesuada. Integer id magna et ipsum cursus vestibulum.,10/2/2023 10:32,Draft
1182,36,"dolor elit,","sed, hendrerit a, arcu. Sed et libero. Proin mi. Aliquam",5/20/2023 18:12,Published
1356,32,amet lorem,"diam dictum sapien. Aenean massa. Integer vitae nibh. Donec est mauris,",5/9/2023 19:47,Published
1217,27,lacus. Ut,erat eget ipsum. Suspendisse sagittis. Nullam vitae diam. Proin dolor. Nulla semper tellus id nunc interdum feugiat.,5/22/2023 5:47,Published
1320,11,arcu. Vestibulum,Vestibulum accumsan neque et nunc. Quisque ornare tortor at risus. Nunc,8/6/2023 8:26,Published
1112,39,tempor augue,"tincidunt orci quis lectus. Nullam suscipit, est ac facilisis facilisis, magna tellus faucibus leo, in lobortis tellus justo sit amet",9/1/2023 1:44,Draft
1152,2,Donec egestas.,"nisl. Nulla eu neque pellentesque massa lobortis ultrices. Vivamus rhoncus. Donec est. Nunc ullamcorper, velit in aliquet lobortis, nisi nibh lacinia orci, consectetuer",9/11/2023 14:04,Draft
1090,16,"tristique pellentesque,","elit, dictum eu, eleifend nec, malesuada ut, sem. Nulla interdum. Curabitur dictum. Phasellus in felis. Nulla tempor augue ac ipsum. Phasellus",1/13/2024 4:44,Draft
1163,36,"vel, convallis","Proin non massa non ante bibendum ullamcorper. Duis cursus, diam at pretium aliquet, metus urna convallis erat, eget tincidunt dui augue eu tellus. Phasellus",9/13/2023 2:37,Draft
1040,26,dictum sapien.,"ipsum leo elementum sem, vitae aliquam eros turpis non enim. Mauris quis turpis vitae purus",2/10/2024 3:48,Published
1205,38,"Donec elementum,","urna justo faucibus lectus, a sollicitudin orci sem eget massa. Suspendisse eleifend. Cras sed leo. Cras vehicula aliquet libero. Integer in magna.",10/31/2023 0:14,Draft
1071,13,Donec est.,lectus justo eu arcu. Morbi sit amet massa. Quisque porttitor,2/10/2024 9:33,Draft
1107,39,eu tellus.,ridiculus mus. Donec dignissim magna a tortor. Nunc commodo auctor velit. Aliquam,8/29/2023 11:27,Published
1079,36,auctor. Mauris,"aliquam adipiscing lacus. Ut nec urna et arcu imperdiet ullamcorper. Duis at lacus. Quisque purus sapien, gravida non, sollicitudin a, malesuada id, erat.",3/4/2024 15:25,Published
1057,8,"adipiscing, enim","Phasellus elit pede, malesuada vel, venenatis vel, faucibus id, libero. Donec consectetuer",9/25/2023 9:52,Published
1374,19,Vestibulum ut,"elit. Aliquam auctor, velit eget laoreet posuere, enim nisl elementum purus,",2/8/2024 22:46,Draft
1383,25,fames ac,"felis eget varius ultrices, mauris ipsum porta elit, a feugiat tellus lorem eu metus. In lorem. Donec elementum,",5/18/2023 9:18,Draft
1254,16,Donec vitae,"Cras lorem lorem, luctus ut, pellentesque eget, dictum placerat, augue.",11/25/2023 9:54,Published
1191,14,mauris. Integer,"auctor odio a purus. Duis elementum, dui quis accumsan convallis, ante lectus convallis est, vitae",5/23/2023 15:32,Draft
1045,26,ultrices posuere,"amet ornare lectus justo eu arcu. Morbi sit amet massa. Quisque porttitor eros nec tellus. Nunc lectus pede, ultrices",3/23/2024 11:35,Published
1079,11,ante ipsum,"sem semper erat, in consectetuer ipsum nunc id enim. Curabitur massa. Vestibulum accumsan neque et nunc. Quisque ornare tortor at risus.",10/15/2023 20:42,Published
1144,33,magna. Cras,"Nullam nisl. Maecenas malesuada fringilla est. Mauris eu turpis. Nulla aliquet. Proin velit. Sed malesuada augue ut lacus. Nulla tincidunt, neque vitae",9/24/2023 13:10,Published
1267,31,"non, lacinia","vestibulum lorem, sit amet ultricies sem magna nec quam. Curabitur vel lectus.",7/4/2023 8:27,Published
1387,33,Nunc laoreet,Proin ultrices. Duis volutpat nunc sit amet metus. Aliquam erat volutpat. Nulla facilisis. Suspendisse,10/8/2023 3:56,Draft
1056,11,mattis. Integer,"dui. Suspendisse ac metus vitae velit egestas lacinia. Sed congue, elit sed consequat auctor, nunc nulla vulputate dui, nec tempus mauris",8/15/2023 7:07,Draft
1152,32,"lacinia at,","euismod in, dolor. Fusce feugiat. Lorem ipsum dolor sit amet,",10/24/2023 15:57,Published
1255,7,"condimentum eget,",enim. Mauris quis turpis vitae purus gravida sagittis. Duis gravida. Praesent eu nulla,4/17/2024 20:46,Published
1356,26,"mauris elit,",nulla. In tincidunt congue turpis. In condimentum. Donec at arcu. Vestibulum ante ipsum primis in faucibus orci,1/17/2024 7:52,Draft
1137,20,"ultrices, mauris",nec mauris blandit mattis. Cras eget nisi dictum augue malesuada malesuada. Integer id magna et ipsum cursus,10/31/2023 21:40,Published
1275,34,Vestibulum ante,convallis convallis dolor. Quisque tincidunt pede ac urna. Ut tincidunt vehicula risus. Nulla eget,10/1/2023 22:18,Published
1052,36,Nulla dignissim.,"magna. Lorem ipsum dolor sit amet, consectetuer adipiscing elit. Etiam laoreet, libero",1/11/2024 5:48,Published
1230,19,a neque.,nonummy ipsum non arcu. Vivamus sit amet risus. Donec egestas. Aliquam nec enim. Nunc,12/20/2023 14:22,Published
1316,14,a neque.,"ornare, elit elit fermentum risus, at fringilla purus mauris a nunc. In",6/2/2023 20:52,Published
1222,20,"dapibus rutrum,",Pellentesque habitant morbi tristique senectus et netus et malesuada fames ac turpis egestas. Fusce aliquet magna a neque. Nullam ut,7/6/2023 13:45,Draft
1391,4,"mauris elit,",Curabitur dictum. Phasellus in felis. Nulla tempor augue ac ipsum. Phasellus vitae mauris sit amet lorem semper auctor. Mauris vel,9/6/2023 18:14,Draft
1125,23,libero. Morbi,"elit elit fermentum risus, at fringilla purus mauris a nunc. In at pede. Cras vulputate velit eu sem. Pellentesque ut ipsum ac mi",8/18/2023 6:55,Draft
1237,16,"vel, venenatis",Vivamus nisi. Mauris nulla. Integer urna. Vivamus molestie dapibus ligula. Aliquam erat volutpat. Nulla dignissim. Maecenas ornare egestas ligula. Nullam feugiat placerat velit. Quisque,3/19/2024 3:08,Draft
1020,36,Nullam feugiat,"felis purus ac tellus. Suspendisse sed dolor. Fusce mi lorem, vehicula et, rutrum eu, ultrices sit amet, risus. Donec nibh",4/30/2024 16:23,Published
1011,33,"fermentum risus,","ac, feugiat non, lobortis quis, pede. Suspendisse dui. Fusce diam",7/25/2023 19:03,Draft
1383,21,"cursus in,","montes, nascetur ridiculus mus. Proin vel arcu eu odio tristique pharetra. Quisque ac libero nec",2/13/2024 3:12,Published
1188,23,"faucibus lectus,","dictum placerat, augue. Sed molestie. Sed id risus quis diam",2/5/2024 5:03,Published
1328,32,"non, bibendum",sollicitudin adipiscing ligula. Aenean gravida nunc sed pede. Cum sociis natoque,6/2/2023 13:42,Published
1043,6,nec urna,"nonummy ipsum non arcu. Vivamus sit amet risus. Donec egestas. Aliquam nec enim. Nunc ut erat. Sed nunc est, mollis non, cursus non, egestas a,",9/13/2023 9:38,Draft
1096,15,metus eu,"dictum mi, ac mattis velit justo nec ante. Maecenas mi felis, adipiscing fringilla,",9/19/2023 15:11,Published
1091,8,lacinia mattis.,"in lobortis tellus justo sit amet nulla. Donec non justo. Proin non massa non ante bibendum ullamcorper. Duis cursus, diam",11/17/2023 3:15,Published
1269,37,"pharetra ut,",eu elit. Nulla facilisi. Sed neque. Sed eget lacus. Mauris non dui nec,4/4/2024 0:00,Draft
1115,21,sociis natoque,Praesent luctus. Curabitur egestas nunc sed libero. Proin sed turpis nec mauris blandit mattis. Cras eget nisi dictum augue malesuada,7/17/2023 15:31,Draft
1332,33,"congue, elit","bibendum sed, est. Nunc laoreet lectus quis massa. Mauris vestibulum, neque sed dictum",3/1/2024 0:33,Draft
1097,32,"at, iaculis","vitae, orci. Phasellus dapibus quam quis diam. Pellentesque habitant morbi",8/28/2023 10:36,Draft
1349,6,Etiam bibendum,cursus. Integer mollis. Integer tincidunt aliquam arcu. Aliquam ultrices iaculis odio. Nam interdum,5/22/2023 21:33,Draft
1047,7,odio vel,"dapibus id, blandit at, nisi. Cum sociis natoque penatibus et magnis dis parturient montes, nascetur ridiculus mus. Proin",7/28/2023 18:51,Published
1061,2,"posuere at,","Maecenas iaculis aliquet diam. Sed diam lorem, auctor quis, tristique ac, eleifend vitae, erat. Vivamus nisi. Mauris nulla. Integer",9/8/2023 0:02,Draft
1396,19,"parturient montes,","Nam nulla magna, malesuada vel, convallis in, cursus et, eros. Proin ultrices.",9/1/2023 8:11,Draft
1253,22,Sed nec,"arcu. Sed eu nibh vulputate mauris sagittis placerat. Cras dictum ultricies ligula. Nullam enim. Sed nulla ante, iaculis nec, eleifend",3/7/2024 7:16,Draft
1282,9,augue. Sed,"dictum eu, eleifend nec, malesuada ut, sem. Nulla interdum. Curabitur dictum.",11/20/2023 4:09,Draft
1233,14,"dapibus rutrum,","purus. Duis elementum, dui quis accumsan convallis, ante lectus convallis est, vitae sodales nisi magna sed dui. Fusce aliquam, enim nec tempus",6/6/2023 12:51,Published
1320,29,Donec consectetuer,"parturient montes, nascetur ridiculus mus. Proin vel arcu eu odio tristique pharetra. Quisque ac libero nec ligula consectetuer",1/26/2024 7:01,Draft
1023,9,ornare tortor,"tellus. Nunc lectus pede, ultrices a, auctor non, feugiat nec, diam. Duis mi enim, condimentum eget, volutpat ornare, facilisis eget, ipsum. Donec sollicitudin adipiscing",7/1/2023 23:32,Draft
1330,23,"iaculis, lacus","eu sem. Pellentesque ut ipsum ac mi eleifend egestas. Sed pharetra, felis eget varius ultrices, mauris",3/15/2024 19:10,Published
1155,26,egestas nunc,"a, auctor non, feugiat nec, diam. Duis mi enim, condimentum eget, volutpat ornare, facilisis eget, ipsum. Donec sollicitudin",6/25/2023 9:58,Published
1123,26,"ut, pharetra","Duis elementum, dui quis accumsan convallis, ante lectus convallis est, vitae sodales nisi magna sed dui. Fusce aliquam, enim nec",5/2/2024 19:01,Published
1147,6,enim diam,"sagittis felis. Donec tempor, est ac mattis semper, dui lectus rutrum urna, nec luctus felis",10/17/2023 18:16,Draft
1185,3,blandit mattis.,"amet risus. Donec egestas. Aliquam nec enim. Nunc ut erat. Sed nunc est, mollis non, cursus non, egestas a,",7/13/2023 6:15,Published
1112,18,volutpat. Nulla,"placerat, orci lacus vestibulum lorem, sit amet ultricies sem magna nec quam. Curabitur vel lectus. Cum sociis natoque penatibus et magnis dis parturient montes,",5/14/2023 7:24,Draft
1139,4,magna. Sed,"lorem tristique aliquet. Phasellus fermentum convallis ligula. Donec luctus aliquet odio. Etiam ligula tortor, dictum eu,",7/10/2023 1:16,Published
1076,34,"eleifend nec,",sem molestie sodales. Mauris blandit enim consequat purus. Maecenas libero,5/4/2023 15:13,Draft
1117,27,mattis. Cras,nec mauris blandit mattis. Cras eget nisi dictum augue malesuada malesuada. Integer id magna et ipsum cursus vestibulum. Mauris magna. Duis dignissim,6/12/2023 0:15,Published
1101,5,commodo tincidunt,"a felis ullamcorper viverra. Maecenas iaculis aliquet diam. Sed diam lorem, auctor quis, tristique ac, eleifend",10/8/2023 17:46,Draft
1332,10,sapien. Cras,"ipsum cursus vestibulum. Mauris magna. Duis dignissim tempor arcu. Vestibulum ut eros non enim commodo hendrerit. Donec porttitor tellus non magna. Nam ligula elit,",2/19/2024 16:20,Draft
1174,21,enim. Etiam,orci. Ut semper pretium neque. Morbi quis urna. Nunc quis arcu vel quam dignissim pharetra. Nam ac,12/24/2023 22:34,Draft
1170,31,et magnis,mauris eu elit. Nulla facilisi. Sed neque. Sed eget lacus. Mauris non,3/26/2024 11:26,Draft
1353,9,"ultrices a,","tristique aliquet. Phasellus fermentum convallis ligula. Donec luctus aliquet odio. Etiam ligula tortor,",4/21/2024 16:02,Draft
1294,4,ipsum primis,"quis lectus. Nullam suscipit, est ac facilisis facilisis, magna tellus faucibus leo, in lobortis tellus justo sit amet",10/14/2023 20:30,Published
1299,20,lectus quis,"Donec nibh enim, gravida sit amet, dapibus id, blandit at, nisi. Cum sociis",12/27/2023 19:00,Published
1240,26,Integer mollis.,"rutrum. Fusce dolor quam, elementum at, egestas a, scelerisque sed, sapien. Nunc pulvinar arcu et pede. Nunc sed",1/22/2024 9:00,Published
1040,11,non justo.,"augue porttitor interdum. Sed auctor odio a purus. Duis elementum, dui quis accumsan convallis, ante lectus convallis est, vitae sodales nisi magna sed dui.",10/26/2023 6:09,Published
1322,5,Nunc mauris,a neque. Nullam ut nisi a odio semper cursus. Integer mollis. Integer tincidunt aliquam arcu. Aliquam ultrices iaculis odio.,1/29/2024 2:32,Published
1352,31,vel arcu.,"orci, in consequat enim diam vel arcu. Curabitur ut odio vel est tempor bibendum. Donec felis orci, adipiscing",10/14/2023 23:18,Draft
1157,38,Etiam ligula,id magna et ipsum cursus vestibulum. Mauris magna. Duis dignissim tempor arcu. Vestibulum ut eros non,5/17/2023 12:06,Published
1230,28,neque. Nullam,"semper auctor. Mauris vel turpis. Aliquam adipiscing lobortis risus. In mi pede, nonummy ut, molestie",9/14/2023 12:51,Published
1370,25,"eu, ultrices","metus. In lorem. Donec elementum, lorem ut aliquam iaculis, lacus pede sagittis augue, eu tempor erat neque non quam. Pellentesque habitant morbi",1/19/2024 9:45,Draft
1220,12,eu arcu.,"in, cursus et, eros. Proin ultrices. Duis volutpat nunc sit amet",10/15/2023 7:51,Draft
1045,12,ante. Maecenas,eros. Nam consequat dolor vitae dolor. Donec fringilla. Donec feugiat metus sit amet ante. Vivamus non lorem vitae odio sagittis semper.,11/10/2023 7:48,Draft
1083,15,libero nec,"massa. Integer vitae nibh. Donec est mauris, rhoncus id, mollis nec, cursus a,",7/6/2023 16:41,Draft
1243,22,"aliquam iaculis,",est. Mauris eu turpis. Nulla aliquet. Proin velit. Sed malesuada augue ut lacus. Nulla,11/25/2023 4:25,Published
1275,13,"convallis in,","mi. Aliquam gravida mauris ut mi. Duis risus odio, auctor vitae, aliquet nec, imperdiet nec, leo. Morbi neque tellus,",11/7/2023 20:53,Draft
1370,35,scelerisque scelerisque,"amet metus. Aliquam erat volutpat. Nulla facilisis. Suspendisse commodo tincidunt nibh. Phasellus nulla. Integer vulputate,",12/7/2023 1:24,Draft
1244,19,"molestie in,","neque sed dictum eleifend, nunc risus varius orci, in consequat enim diam vel arcu. Curabitur ut odio vel est tempor",4/28/2024 3:20,Draft
1327,22,et ultrices,"est tempor bibendum. Donec felis orci, adipiscing non, luctus sit amet, faucibus ut, nulla. Cras eu",4/21/2024 23:30,Draft
1374,37,ultricies dignissim,"Donec tempor, est ac mattis semper, dui lectus rutrum urna, nec luctus felis purus ac tellus. Suspendisse sed dolor. Fusce",5/21/2023 17:02,Draft
1372,24,"dolor, tempus","sagittis felis. Donec tempor, est ac mattis semper, dui lectus rutrum urna, nec luctus",2/10/2024 11:29,Draft
1165,10,"consequat, lectus",magna. Duis dignissim tempor arcu. Vestibulum ut eros non enim commodo hendrerit.,10/30/2023 0:37,Draft
1198,24,sodales elit,vitae diam. Proin dolor. Nulla semper tellus id nunc interdum feugiat. Sed nec,4/3/2024 23:59,Published
1278,36,Nullam nisl.,"lectus quis massa. Mauris vestibulum, neque sed dictum eleifend, nunc risus varius orci, in consequat enim diam vel arcu. Curabitur ut odio",10/5/2023 4:52,Draft
1027,21,"mauris elit,","ipsum. Phasellus vitae mauris sit amet lorem semper auctor. Mauris vel turpis. Aliquam adipiscing lobortis risus. In mi pede,",12/16/2023 17:40,Published
1250,28,semper tellus,"Nunc mauris elit, dictum eu, eleifend nec, malesuada ut, sem. Nulla interdum. Curabitur dictum. Phasellus",1/16/2024 18:55,Draft
1380,14,erat eget,"Nunc ut erat. Sed nunc est, mollis non, cursus non, egestas a, dui. Cras pellentesque. Sed dictum. Proin eget odio. Aliquam",2/10/2024 0:56,Draft
1304,7,"non, egestas","aptent taciti sociosqu ad litora torquent per conubia nostra, per inceptos hymenaeos. Mauris ut quam vel sapien",2/7/2024 22:08,Draft
1105,10,orci quis,"euismod in, dolor. Fusce feugiat. Lorem ipsum dolor sit amet, consectetuer adipiscing elit.",12/29/2023 5:36,Published
1237,35,porttitor tellus,"tempus non, lacinia at, iaculis quis, pede. Praesent eu dui. Cum sociis natoque penatibus et magnis dis",1/6/2024 6:09,Published
1058,30,lacus. Mauris,"suscipit, est ac facilisis facilisis, magna tellus faucibus leo, in lobortis tellus justo sit amet nulla. Donec non",11/20/2023 4:21,Published
1044,21,sit amet,"Sed nulla ante, iaculis nec, eleifend non, dapibus rutrum, justo. Praesent luctus. Curabitur egestas nunc sed libero. Proin sed turpis nec",11/3/2023 20:48,Draft
1215,2,"posuere vulputate,","Duis a mi fringilla mi lacinia mattis. Integer eu lacus. Quisque imperdiet, erat nonummy ultricies ornare, elit elit",4/14/2024 15:34,Published
1014,13,"ullamcorper eu,","elit elit fermentum risus, at fringilla purus mauris a nunc. In at pede. Cras vulputate",3/30/2024 17:56,Published
1174,24,risus quis,"nec, diam. Duis mi enim, condimentum eget, volutpat ornare, facilisis eget, ipsum. Donec sollicitudin adipiscing",2/15/2024 19:27,Published
1013,12,libero. Donec,"fermentum metus. Aenean sed pede nec ante blandit viverra. Donec tempus, lorem fringilla ornare placerat, orci lacus",3/3/2024 17:04,Draft
1086,19,"aliquam, enim",sed libero. Proin sed turpis nec mauris blandit mattis. Cras eget nisi dictum augue malesuada malesuada. Integer id magna et ipsum cursus vestibulum. Mauris,7/18/2023 0:04,Published
1127,31,sit amet,"sed dui. Fusce aliquam, enim nec tempus scelerisque, lorem ipsum sodales purus, in molestie",4/26/2024 21:58,Published
1336,31,fringilla mi,"auctor. Mauris vel turpis. Aliquam adipiscing lobortis risus. In mi pede, nonummy ut, molestie",6/19/2023 0:03,Draft
1187,17,aliquet. Phasellus,"est, congue a, aliquet vel, vulputate eu, odio. Phasellus at augue id ante dictum cursus. Nunc mauris elit, dictum",11/23/2023 15:56,Published
1362,16,"montes, nascetur","montes, nascetur ridiculus mus. Donec dignissim magna a tortor. Nunc commodo auctor",9/21/2023 4:52,Draft
1138,9,sapien molestie,"diam luctus lobortis. Class aptent taciti sociosqu ad litora torquent per conubia nostra, per inceptos hymenaeos. Mauris ut quam",2/4/2024 6:23,Published
1298,3,"semper erat,","Morbi accumsan laoreet ipsum. Curabitur consequat, lectus sit amet luctus vulputate, nisi sem semper",12/14/2023 18:00,Published
1178,5,lectus quis,"Donec tempus, lorem fringilla ornare placerat, orci lacus vestibulum lorem, sit",3/6/2024 5:41,Published
1208,14,non massa,mattis. Cras eget nisi dictum augue malesuada malesuada. Integer id magna et ipsum cursus vestibulum. Mauris magna. Duis dignissim tempor arcu. Vestibulum ut,8/23/2023 1:50,Draft
1391,26,libero. Integer,"justo nec ante. Maecenas mi felis, adipiscing fringilla, porttitor vulputate, posuere vulputate, lacus. Cras interdum. Nunc",12/5/2023 3:37,Draft
1175,22,"Curabitur consequat,","non, dapibus rutrum, justo. Praesent luctus. Curabitur egestas nunc sed libero. Proin sed turpis nec mauris blandit mattis. Cras eget nisi dictum augue malesuada malesuada.",3/30/2024 3:51,Published
1322,21,tincidunt vehicula,"nulla vulputate dui, nec tempus mauris erat eget ipsum. Suspendisse sagittis. Nullam vitae diam. Proin dolor. Nulla semper tellus id nunc interdum feugiat.",6/24/2023 14:47,Draft
1220,5,ornare egestas,eros. Nam consequat dolor vitae dolor. Donec fringilla. Donec feugiat metus sit amet ante. Vivamus non lorem vitae odio sagittis semper.,5/30/2023 13:47,Published
1275,31,"sem, consequat",eros. Nam consequat dolor vitae dolor. Donec fringilla. Donec feugiat metus sit amet ante. Vivamus non lorem vitae odio sagittis semper. Nam tempor diam,5/10/2023 18:39,Draft
1299,13,"aliquet lobortis,","risus a ultricies adipiscing, enim mi tempor lorem, eget mollis lectus pede et risus. Quisque libero lacus, varius et, euismod et, commodo",1/9/2024 16:11,Published
1058,26,"at, nisi.","fermentum metus. Aenean sed pede nec ante blandit viverra. Donec tempus, lorem fringilla ornare placerat, orci lacus",11/23/2023 11:44,Draft
1363,18,Vestibulum ut,"a, dui. Cras pellentesque. Sed dictum. Proin eget odio. Aliquam vulputate ullamcorper magna. Sed eu eros. Nam consequat dolor vitae dolor. Donec fringilla. Donec",1/2/2024 18:37,Draft
1188,5,metus facilisis,"sodales at, velit. Pellentesque ultricies dignissim lacus. Aliquam rutrum lorem ac risus. Morbi metus. Vivamus euismod urna. Nullam lobortis quam a felis ullamcorper viverra. Maecenas",3/24/2024 7:09,Published
1093,4,sapien molestie,"Suspendisse commodo tincidunt nibh. Phasellus nulla. Integer vulputate, risus a ultricies adipiscing, enim mi tempor lorem, eget mollis lectus",11/19/2023 12:14,Published
1119,11,gravida sit,"tempor, est ac mattis semper, dui lectus rutrum urna, nec luctus felis purus ac tellus. Suspendisse sed dolor.",12/7/2023 2:35,Published
1214,16,vestibulum. Mauris,"porttitor vulputate, posuere vulputate, lacus. Cras interdum. Nunc sollicitudin commodo ipsum.",3/14/2024 10:26,Draft
1128,37,nibh lacinia,"tempus scelerisque, lorem ipsum sodales purus, in molestie tortor nibh sit amet orci.",12/11/2023 12:58,Published
1070,28,"tellus, imperdiet",Vivamus molestie dapibus ligula. Aliquam erat volutpat. Nulla dignissim. Maecenas ornare egestas ligula. Nullam feugiat placerat velit. Quisque,1/23/2024 10:11,Draft
1398,25,non dui,"ullamcorper, velit in aliquet lobortis, nisi nibh lacinia orci, consectetuer euismod est arcu ac orci. Ut semper",12/20/2023 19:46,Draft
1383,31,semper pretium,"ipsum. Donec sollicitudin adipiscing ligula. Aenean gravida nunc sed pede. Cum sociis natoque penatibus et magnis dis parturient montes, nascetur ridiculus mus. Proin vel arcu",11/25/2023 21:55,Draft
1024,9,"mi lorem,","orci, adipiscing non, luctus sit amet, faucibus ut, nulla. Cras eu tellus eu augue porttitor interdum. Sed",12/14/2023 18:49,Draft
1133,27,aliquam adipiscing,"Ut tincidunt vehicula risus. Nulla eget metus eu erat semper rutrum. Fusce dolor quam, elementum at, egestas",9/19/2023 9:11,Draft
1177,35,vel arcu,"orci lobortis augue scelerisque mollis. Phasellus libero mauris, aliquam eu, accumsan sed, facilisis",1/22/2024 17:28,Published
1035,6,"vulputate, lacus.","quis, tristique ac, eleifend vitae, erat. Vivamus nisi. Mauris nulla. Integer urna.",6/17/2023 14:31,Draft
1385,38,Etiam imperdiet,"Maecenas libero est, congue a, aliquet vel, vulputate eu, odio. Phasellus",9/7/2023 8:40,Published
1097,17,"laoreet, libero","metus sit amet ante. Vivamus non lorem vitae odio sagittis semper. Nam tempor diam dictum sapien. Aenean massa. Integer vitae nibh. Donec est mauris,",6/10/2023 18:44,Published
1170,24,"vel, venenatis","orci quis lectus. Nullam suscipit, est ac facilisis facilisis, magna tellus faucibus leo, in",11/1/2023 12:54,Draft
1001,34,dui nec,"dolor egestas rhoncus. Proin nisl sem, consequat nec, mollis vitae, posuere at, velit.",2/2/2024 11:33,Published
1199,9,"enim, sit","mattis velit justo nec ante. Maecenas mi felis, adipiscing fringilla, porttitor vulputate, posuere vulputate, lacus. Cras interdum.",7/30/2023 12:13,Published
1131,32,lectus. Nullam,tortor nibh sit amet orci. Ut sagittis lobortis mauris. Suspendisse aliquet molestie tellus. Aenean egestas hendrerit neque. In ornare sagittis felis. Donec,12/14/2023 4:45,Draft
1169,14,eu erat,"scelerisque neque. Nullam nisl. Maecenas malesuada fringilla est. Mauris eu turpis. Nulla aliquet. Proin velit. Sed malesuada augue ut lacus. Nulla tincidunt,",11/28/2023 22:00,Draft
1242,36,Nunc sed,"euismod enim. Etiam gravida molestie arcu. Sed eu nibh vulputate mauris sagittis placerat. Cras dictum ultricies ligula. Nullam enim. Sed nulla ante,",6/16/2023 15:27,Published
1131,24,"a, auctor","pede. Cras vulputate velit eu sem. Pellentesque ut ipsum ac mi eleifend egestas. Sed pharetra,",4/10/2024 0:52,Draft
1382,28,justo. Proin,"Nunc commodo auctor velit. Aliquam nisl. Nulla eu neque pellentesque massa lobortis ultrices. Vivamus rhoncus. Donec est. Nunc ullamcorper, velit",8/25/2023 22:43,Draft
1176,26,"vel, mauris.",mattis. Cras eget nisi dictum augue malesuada malesuada. Integer id magna et ipsum cursus vestibulum. Mauris magna. Duis dignissim,7/10/2023 7:47,Published
1280,17,libero. Proin,a odio semper cursus. Integer mollis. Integer tincidunt aliquam arcu. Aliquam ultrices iaculis odio. Nam interdum enim non nisi. Aenean eget metus. In nec orci.,4/12/2024 13:55,Published
1173,12,Donec est,"Suspendisse non leo. Vivamus nibh dolor, nonummy ac, feugiat non, lobortis quis, pede. Suspendisse dui. Fusce diam nunc, ullamcorper",6/7/2023 4:28,Published
1159,15,et risus.,"eget metus eu erat semper rutrum. Fusce dolor quam, elementum at, egestas a,",8/3/2023 5:35,Published
1289,7,nec luctus,"dapibus gravida. Aliquam tincidunt, nunc ac mattis ornare, lectus ante dictum mi, ac mattis velit justo nec ante. Maecenas mi",5/11/2023 9:22,Draft
1139,24,pharetra. Quisque,"nisi magna sed dui. Fusce aliquam, enim nec tempus scelerisque, lorem ipsum sodales purus,",5/26/2023 1:12,Published
1165,1,eget tincidunt,"id, blandit at, nisi. Cum sociis natoque penatibus et magnis dis",9/26/2023 9:58,Published
1391,24,"enim, sit","Nunc sollicitudin commodo ipsum. Suspendisse non leo. Vivamus nibh dolor, nonummy ac, feugiat non, lobortis quis, pede. Suspendisse dui. Fusce diam nunc, ullamcorper eu,",5/21/2023 23:36,Published
1243,23,Cum sociis,enim. Etiam gravida molestie arcu. Sed eu nibh vulputate mauris sagittis placerat. Cras,1/6/2024 16:09,Published
1277,4,Nulla facilisi.,"porttitor interdum. Sed auctor odio a purus. Duis elementum, dui quis",2/26/2024 13:17,Draft
1021,24,"Etiam laoreet,",sit amet orci. Ut sagittis lobortis mauris. Suspendisse aliquet molestie,8/12/2023 23:37,Published
1397,10,metus. Vivamus,Maecenas ornare egestas ligula. Nullam feugiat placerat velit. Quisque varius. Nam porttitor,11/21/2023 20:24,Published
1177,22,nascetur ridiculus,"augue ut lacus. Nulla tincidunt, neque vitae semper egestas, urna justo faucibus",9/22/2023 23:30,Published
