post_id,tag_id,title,content,date_published,status
1250,8,viverra. Maecenas,"rutrum eu, ultrices sit amet, risus. Donec nibh enim, gravida sit amet, dapibus id, blandit at, nisi. Cum sociis",12/11/2023 15:50,Published
1083,8,quam. Curabitur,"cursus in, hendrerit consectetuer, cursus et, magna. Praesent interdum ligula eu enim.",2/18/2024 4:48,Published
1375,29,"dui, semper","urna et arcu imperdiet ullamcorper. Duis at lacus. Quisque purus sapien, gravida",9/6/2023 3:22,Draft
1246,6,id ante,"egestas a, scelerisque sed, sapien. Nunc pulvinar arcu et pede. Nunc sed orci lobortis augue scelerisque mollis. Phasellus libero",7/2/2023 9:34,Published
1323,1,iaculis odio.,"et, lacinia vitae, sodales at, velit. Pellentesque ultricies dignissim lacus.",8/13/2023 6:52,Draft
1327,36,"et, euismod",eget nisi dictum augue malesuada malesuada. Integer id magna et ipsum cursus vestibulum. Mauris,6/4/2023 17:39,Published
1262,3,a purus.,"interdum. Nunc sollicitudin commodo ipsum. Suspendisse non leo. Vivamus nibh dolor, nonummy ac, feugiat non, lobortis",5/8/2023 13:47,Draft
1100,4,molestie tellus.,"amet, faucibus ut, nulla. Cras eu tellus eu augue porttitor interdum. Sed",11/15/2023 23:55,Published
1089,18,nec luctus,"tempor lorem, eget mollis lectus pede et risus. Quisque libero lacus, varius et, euismod et, commodo at,",2/10/2024 20:28,Published
1128,15,"vulputate, nisi",lacus. Mauris non dui nec urna suscipit nonummy. Fusce fermentum fermentum arcu. Vestibulum ante,2/20/2024 4:39,Draft
1137,32,Donec fringilla.,magna. Sed eu eros. Nam consequat dolor vitae dolor. Donec fringilla. Donec feugiat metus sit amet ante. Vivamus non lorem,2/14/2024 20:43,Draft
1129,36,"non, cursus","sollicitudin a, malesuada id, erat. Etiam vestibulum massa rutrum magna. Cras convallis",2/9/2024 18:32,Draft
1033,33,"mauris, rhoncus","faucibus leo, in lobortis tellus justo sit amet nulla. Donec",10/16/2023 21:59,Published
1178,12,ante lectus,vitae dolor. Donec fringilla. Donec feugiat metus sit amet ante. Vivamus non lorem,3/21/2024 20:13,Draft
1143,27,Donec tincidunt.,diam. Pellentesque habitant morbi tristique senectus et netus et malesuada fames ac turpis egestas. Fusce aliquet magna a neque. Nullam ut nisi a odio,9/14/2023 14:40,Draft
1349,18,eu odio,"purus. Nullam scelerisque neque sed sem egestas blandit. Nam nulla magna, malesuada vel, convallis in, cursus et, eros. Proin ultrices. Duis volutpat nunc sit",2/4/2024 4:47,Draft
1329,26,ipsum non,orci. Phasellus dapibus quam quis diam. Pellentesque habitant morbi tristique senectus et netus et malesuada fames ac turpis egestas.,11/18/2023 20:12,Draft
1246,15,magna. Cras,"magna. Nam ligula elit, pretium et, rutrum non, hendrerit id, ante. Nunc mauris sapien, cursus in, hendrerit consectetuer,",10/16/2023 16:59,Published
1363,24,enim non,Aenean gravida nunc sed pede. Cum sociis natoque penatibus et magnis dis,9/6/2023 1:39,Draft
1247,35,Donec vitae,risus. Morbi metus. Vivamus euismod urna. Nullam lobortis quam a felis ullamcorper,5/24/2023 14:34,Published
1119,23,diam. Proin,odio semper cursus. Integer mollis. Integer tincidunt aliquam arcu. Aliquam ultrices iaculis odio. Nam interdum enim non nisi. Aenean eget,2/4/2024 23:56,Draft
1191,9,"semper et,","ligula. Donec luctus aliquet odio. Etiam ligula tortor, dictum eu, placerat eget, venenatis a, magna. Lorem ipsum dolor sit amet, consectetuer adipiscing elit. Etiam",3/30/2024 11:05,Draft
1205,19,"et, lacinia","enim, gravida sit amet, dapibus id, blandit at, nisi. Cum sociis natoque penatibus et magnis dis parturient montes, nascetur ridiculus mus. Proin vel nisl.",4/23/2024 6:27,Published
1212,30,"sollicitudin a,","lobortis, nisi nibh lacinia orci, consectetuer euismod est arcu ac orci. Ut semper pretium neque. Morbi quis urna. Nunc",5/22/2023 1:38,Draft
1115,34,"dui, in","fermentum metus. Aenean sed pede nec ante blandit viverra. Donec tempus, lorem fringilla ornare placerat, orci",12/17/2023 17:08,Draft
1388,12,"diam nunc,","sem mollis dui, in sodales elit erat vitae risus. Duis a mi",6/19/2023 6:32,Published
1390,34,scelerisque scelerisque,"metus. In lorem. Donec elementum, lorem ut aliquam iaculis, lacus pede sagittis augue, eu tempor erat neque non quam. Pellentesque habitant morbi",3/26/2024 11:30,Draft
1215,19,Donec dignissim,"Maecenas mi felis, adipiscing fringilla, porttitor vulputate, posuere vulputate, lacus. Cras interdum. Nunc sollicitudin commodo ipsum. Suspendisse",7/27/2023 16:16,Draft
1082,30,"mi enim,","elit fermentum risus, at fringilla purus mauris a nunc. In at",8/26/2023 14:37,Draft
1003,26,"urna, nec",consectetuer adipiscing elit. Curabitur sed tortor. Integer aliquam adipiscing lacus. Ut,12/13/2023 6:33,Draft
1238,38,risus. Donec,"a, auctor non, feugiat nec, diam. Duis mi enim, condimentum eget, volutpat ornare, facilisis eget, ipsum. Donec sollicitudin adipiscing ligula. Aenean",9/21/2023 9:27,Draft
1148,21,dolor dapibus,"Donec est mauris, rhoncus id, mollis nec, cursus a, enim. Suspendisse aliquet, sem ut cursus luctus, ipsum leo",11/20/2023 21:45,Published
1390,22,eget lacus.,"a, enim. Suspendisse aliquet, sem ut cursus luctus, ipsum leo elementum sem, vitae aliquam eros turpis non enim. Mauris quis",6/3/2023 22:50,Published
1018,14,et malesuada,Mauris ut quam vel sapien imperdiet ornare. In faucibus. Morbi vehicula. Pellentesque tincidunt tempus risus. Donec egestas. Duis ac arcu. Nunc mauris.,6/9/2023 5:36,Draft
1300,24,pellentesque massa,"Sed id risus quis diam luctus lobortis. Class aptent taciti sociosqu ad litora torquent per conubia nostra, per inceptos hymenaeos. Mauris",7/8/2023 0:35,Draft
1176,19,"ornare placerat,",in felis. Nulla tempor augue ac ipsum. Phasellus vitae mauris sit amet lorem semper auctor.,2/15/2024 18:52,Published
1098,37,"convallis, ante","ante dictum cursus. Nunc mauris elit, dictum eu, eleifend nec, malesuada ut, sem. Nulla interdum. Curabitur dictum. Phasellus in felis. Nulla",10/30/2023 20:14,Published
1381,5,Cras eget,pretium neque. Morbi quis urna. Nunc quis arcu vel quam dignissim pharetra. Nam ac,5/27/2023 7:25,Published
1259,36,"posuere, enim",ipsum primis in faucibus orci luctus et ultrices posuere cubilia,9/25/2023 0:43,Published
1209,28,neque. Sed,"id, erat. Etiam vestibulum massa rutrum magna. Cras convallis convallis dolor. Quisque tincidunt pede",6/29/2023 22:03,Draft
1362,22,"sit amet,","pede, nonummy ut, molestie in, tempus eu, ligula. Aenean euismod mauris eu elit. Nulla facilisi. Sed neque. Sed eget",2/5/2024 3:00,Published
1339,3,pede nec,"ac ipsum. Phasellus vitae mauris sit amet lorem semper auctor. Mauris vel turpis. Aliquam adipiscing lobortis risus. In mi pede, nonummy ut, molestie",12/18/2023 7:38,Published
1135,3,Nulla facilisis.,Nullam lobortis quam a felis ullamcorper viverra. Maecenas iaculis aliquet diam. Sed,2/11/2024 9:16,Draft
1033,4,magna. Sed,erat volutpat. Nulla dignissim. Maecenas ornare egestas ligula. Nullam feugiat placerat velit. Quisque varius. Nam porttitor scelerisque neque.,5/1/2024 20:25,Published
1146,18,non enim,"commodo at, libero. Morbi accumsan laoreet ipsum. Curabitur consequat, lectus sit",10/31/2023 13:59,Published
1163,34,Nunc lectus,Sed nec metus facilisis lorem tristique aliquet. Phasellus fermentum convallis ligula. Donec luctus aliquet odio. Etiam,1/10/2024 1:04,Published
1215,6,Nulla tempor,"Cras lorem lorem, luctus ut, pellentesque eget, dictum placerat, augue. Sed molestie. Sed id risus quis diam luctus lobortis. Class aptent taciti sociosqu ad",11/24/2023 16:31,Published
1139,6,tellus lorem,"tristique pharetra. Quisque ac libero nec ligula consectetuer rhoncus. Nullam velit dui, semper et, lacinia",4/1/2024 5:50,Draft
1382,31,"elit, pharetra",Nulla interdum. Curabitur dictum. Phasellus in felis. Nulla tempor augue ac ipsum. Phasellus vitae mauris sit amet lorem semper auctor.,9/13/2023 13:38,Draft
1048,2,lacus pede,"tempor, est ac mattis semper, dui lectus rutrum urna, nec luctus felis purus ac tellus.",5/6/2023 13:31,Published
1247,28,Curabitur egestas,"Nunc ac sem ut dolor dapibus gravida. Aliquam tincidunt, nunc ac mattis ornare, lectus",7/10/2023 9:34,Draft
1008,3,"amet, consectetuer","consectetuer mauris id sapien. Cras dolor dolor, tempus non, lacinia at,",6/21/2023 16:36,Draft
1290,35,Etiam bibendum,"pellentesque a, facilisis non, bibendum sed, est. Nunc laoreet lectus quis massa. Mauris vestibulum, neque sed dictum eleifend,",11/26/2023 23:02,Draft
1104,18,consectetuer adipiscing,eu elit. Nulla facilisi. Sed neque. Sed eget lacus. Mauris non dui nec urna suscipit nonummy. Fusce fermentum fermentum arcu. Vestibulum ante ipsum primis in,6/10/2023 3:45,Draft
1144,19,Ut nec,"amet risus. Donec egestas. Aliquam nec enim. Nunc ut erat. Sed nunc est, mollis non, cursus non, egestas a, dui. Cras pellentesque.",12/1/2023 0:15,Draft
1073,3,sit amet,"parturient montes, nascetur ridiculus mus. Proin vel arcu eu odio tristique pharetra. Quisque ac libero nec ligula",12/2/2023 19:07,Draft
1131,4,vulputate ullamcorper,"Duis elementum, dui quis accumsan convallis, ante lectus convallis est, vitae sodales nisi magna sed dui. Fusce",1/4/2024 0:19,Published
1108,9,semper pretium,in lobortis tellus justo sit amet nulla. Donec non justo. Proin non massa non,2/12/2024 3:17,Published
1083,8,"risus, at","adipiscing lacus. Ut nec urna et arcu imperdiet ullamcorper. Duis at lacus. Quisque purus sapien, gravida non, sollicitudin a, malesuada",9/4/2023 9:28,Draft
1245,2,arcu. Aliquam,"magna nec quam. Curabitur vel lectus. Cum sociis natoque penatibus et magnis dis parturient montes, nascetur ridiculus mus. Donec",8/5/2023 5:23,Published
1007,32,molestie. Sed,"Nunc ut erat. Sed nunc est, mollis non, cursus non, egestas a, dui. Cras pellentesque. Sed dictum. Proin",8/13/2023 7:12,Draft
1293,9,Ut tincidunt,Aliquam erat volutpat. Nulla dignissim. Maecenas ornare egestas ligula. Nullam feugiat placerat,1/23/2024 14:40,Draft
1130,34,"sem elit,","elit elit fermentum risus, at fringilla purus mauris a nunc. In at pede. Cras vulputate velit",6/8/2023 12:55,Draft
1009,2,adipiscing lacus.,"erat, eget tincidunt dui augue eu tellus. Phasellus elit pede, malesuada vel, venenatis vel,",1/24/2024 13:28,Published
1144,4,nulla. In,eget nisi dictum augue malesuada malesuada. Integer id magna et ipsum,2/19/2024 5:00,Draft
1346,15,"varius et,",mauris blandit mattis. Cras eget nisi dictum augue malesuada malesuada. Integer id magna et,9/19/2023 21:55,Published
1025,25,amet risus.,"suscipit, est ac facilisis facilisis, magna tellus faucibus leo, in lobortis tellus",5/29/2023 15:42,Draft
1220,38,"purus, in","libero. Proin mi. Aliquam gravida mauris ut mi. Duis risus odio, auctor vitae, aliquet nec, imperdiet",8/29/2023 6:49,Published
1358,10,commodo auctor,"Donec est mauris, rhoncus id, mollis nec, cursus a, enim. Suspendisse aliquet, sem ut",10/19/2023 11:20,Draft
1160,9,in magna.,"Maecenas iaculis aliquet diam. Sed diam lorem, auctor quis, tristique ac, eleifend vitae, erat. Vivamus nisi. Mauris nulla. Integer urna. Vivamus",9/11/2023 20:49,Draft
1316,18,"in, dolor.","parturient montes, nascetur ridiculus mus. Proin vel nisl. Quisque fringilla euismod enim. Etiam gravida molestie arcu. Sed eu nibh vulputate mauris sagittis",4/12/2024 20:01,Published
1168,13,lectus sit,dolor vitae dolor. Donec fringilla. Donec feugiat metus sit amet ante. Vivamus non lorem vitae odio sagittis semper. Nam tempor diam,2/16/2024 11:57,Published
1282,21,non dui,habitant morbi tristique senectus et netus et malesuada fames ac turpis egestas. Aliquam fringilla cursus purus. Nullam,10/16/2023 16:32,Published
1293,27,arcu. Vestibulum,"ipsum dolor sit amet, consectetuer adipiscing elit. Aliquam auctor, velit eget laoreet posuere, enim nisl elementum",9/2/2023 3:46,Published
1205,19,"mollis vitae,","libero nec ligula consectetuer rhoncus. Nullam velit dui, semper et, lacinia vitae, sodales at, velit. Pellentesque ultricies dignissim lacus. Aliquam rutrum lorem ac risus.",12/3/2023 14:03,Published
1117,38,Integer sem,"non ante bibendum ullamcorper. Duis cursus, diam at pretium aliquet, metus urna convallis",5/10/2023 22:08,Published
1098,32,natoque penatibus,"placerat eget, venenatis a, magna. Lorem ipsum dolor sit amet, consectetuer adipiscing elit. Etiam laoreet, libero et tristique pellentesque, tellus",9/19/2023 13:02,Draft
1112,24,"vehicula et,","scelerisque dui. Suspendisse ac metus vitae velit egestas lacinia. Sed congue, elit sed consequat auctor, nunc nulla vulputate dui, nec tempus mauris erat eget ipsum.",10/2/2023 10:07,Published
1149,12,consequat purus.,tincidunt tempus risus. Donec egestas. Duis ac arcu. Nunc mauris. Morbi non sapien molestie orci,12/28/2023 11:17,Published
1059,2,imperdiet ornare.,"semper rutrum. Fusce dolor quam, elementum at, egestas a, scelerisque sed, sapien. Nunc pulvinar arcu et pede. Nunc sed orci lobortis augue scelerisque mollis. Phasellus",5/1/2024 15:50,Draft
1371,15,Ut tincidunt,"auctor vitae, aliquet nec, imperdiet nec, leo. Morbi neque tellus, imperdiet non, vestibulum nec, euismod in, dolor. Fusce feugiat. Lorem ipsum dolor",2/11/2024 8:17,Draft
1012,13,"non, dapibus","est mauris, rhoncus id, mollis nec, cursus a, enim. Suspendisse aliquet, sem ut cursus luctus, ipsum leo",5/30/2023 3:58,Draft
1160,28,aliquet diam.,"magna, malesuada vel, convallis in, cursus et, eros. Proin ultrices. Duis volutpat nunc sit amet metus. Aliquam erat",11/30/2023 12:04,Published
1287,2,eu turpis.,"molestie. Sed id risus quis diam luctus lobortis. Class aptent taciti sociosqu ad litora torquent per conubia nostra, per inceptos hymenaeos. Mauris ut",4/11/2024 5:31,Published
1351,25,dolor. Quisque,Mauris nulla. Integer urna. Vivamus molestie dapibus ligula. Aliquam erat volutpat. Nulla dignissim. Maecenas ornare egestas ligula.,6/29/2023 1:42,Draft
1096,3,pede. Cras,"eu dui. Cum sociis natoque penatibus et magnis dis parturient montes, nascetur ridiculus mus.",8/22/2023 19:39,Published
1359,34,nisi nibh,"volutpat nunc sit amet metus. Aliquam erat volutpat. Nulla facilisis. Suspendisse commodo tincidunt nibh. Phasellus nulla. Integer vulputate, risus a ultricies adipiscing,",1/20/2024 13:51,Published
1352,35,interdum ligula,"molestie in, tempus eu, ligula. Aenean euismod mauris eu elit. Nulla facilisi. Sed neque. Sed eget lacus. Mauris non dui nec urna suscipit",7/30/2023 13:42,Draft
1020,6,Etiam gravida,"enim. Nunc ut erat. Sed nunc est, mollis non, cursus non, egestas a, dui. Cras pellentesque. Sed dictum. Proin eget",8/26/2023 5:17,Published
1026,3,commodo hendrerit.,"ligula. Nullam enim. Sed nulla ante, iaculis nec, eleifend non, dapibus rutrum,",5/25/2023 10:58,Published
1225,25,nonummy. Fusce,"dictum ultricies ligula. Nullam enim. Sed nulla ante, iaculis nec, eleifend non, dapibus rutrum, justo.",1/4/2024 11:40,Draft
1400,20,lorem ipsum,Fusce fermentum fermentum arcu. Vestibulum ante ipsum primis in faucibus orci luctus et ultrices posuere,9/18/2023 19:25,Published
1308,5,lorem fringilla,sem. Nulla interdum. Curabitur dictum. Phasellus in felis. Nulla tempor augue,12/29/2023 14:13,Published
1178,34,lorem fringilla,Nunc commodo auctor velit. Aliquam nisl. Nulla eu neque pellentesque massa lobortis ultrices. Vivamus rhoncus. Donec est. Nunc,6/7/2023 3:00,Draft
1082,24,"Suspendisse aliquet,","arcu. Curabitur ut odio vel est tempor bibendum. Donec felis orci,",3/11/2024 11:00,Draft
1094,26,risus. Donec,"ullamcorper viverra. Maecenas iaculis aliquet diam. Sed diam lorem, auctor quis, tristique ac, eleifend vitae,",3/2/2024 1:39,Draft
1061,13,"sed, est.","vitae velit egestas lacinia. Sed congue, elit sed consequat auctor,",1/13/2024 10:25,Draft
1186,5,augue. Sed,"scelerisque neque sed sem egestas blandit. Nam nulla magna, malesuada vel, convallis in, cursus et, eros. Proin ultrices. Duis volutpat",3/8/2024 17:45,Draft
1057,36,enim mi,"pulvinar arcu et pede. Nunc sed orci lobortis augue scelerisque mollis. Phasellus libero mauris, aliquam eu, accumsan sed, facilisis",3/2/2024 3:00,Draft
1147,14,"libero mauris,","metus. Aenean sed pede nec ante blandit viverra. Donec tempus, lorem fringilla ornare placerat, orci lacus vestibulum lorem, sit amet ultricies sem magna nec",10/7/2023 11:29,Published
1196,14,eros nec,hymenaeos. Mauris ut quam vel sapien imperdiet ornare. In faucibus. Morbi vehicula. Pellentesque tincidunt tempus risus. Donec egestas. Duis ac,3/25/2024 19:31,Draft
1300,22,velit. Pellentesque,"amet, consectetuer adipiscing elit. Curabitur sed tortor. Integer aliquam adipiscing lacus.",8/15/2023 21:38,Draft
1005,21,eleifend egestas.,"Integer vitae nibh. Donec est mauris, rhoncus id, mollis nec, cursus a,",9/22/2023 3:06,Draft
1323,21,massa. Integer,nascetur ridiculus mus. Aenean eget magna. Suspendisse tristique neque venenatis lacus.,9/16/2023 16:47,Draft
1030,19,augue ac,"ipsum dolor sit amet, consectetuer adipiscing elit. Curabitur sed tortor. Integer aliquam adipiscing lacus. Ut nec urna et arcu imperdiet",8/10/2023 15:00,Draft
1023,28,gravida molestie,"sed sem egestas blandit. Nam nulla magna, malesuada vel, convallis",5/6/2023 23:29,Draft
1215,14,enim. Mauris,"amet, consectetuer adipiscing elit. Etiam laoreet, libero et tristique pellentesque, tellus sem mollis dui, in sodales elit erat vitae risus.",4/23/2024 15:17,Draft
1227,35,"consequat, lectus","egestas blandit. Nam nulla magna, malesuada vel, convallis in, cursus et,",5/10/2023 22:17,Draft
1045,3,rutrum. Fusce,"quis diam luctus lobortis. Class aptent taciti sociosqu ad litora torquent per conubia nostra, per inceptos hymenaeos. Mauris ut quam vel sapien imperdiet ornare.",12/27/2023 21:14,Published
1059,26,luctus et,"in, dolor. Fusce feugiat. Lorem ipsum dolor sit amet, consectetuer adipiscing elit. Aliquam auctor, velit eget laoreet posuere, enim nisl",12/10/2023 18:22,Published
1354,37,Proin nisl,"sed orci lobortis augue scelerisque mollis. Phasellus libero mauris, aliquam eu, accumsan sed, facilisis vitae, orci. Phasellus",6/4/2023 2:35,Published
1132,21,scelerisque neque,"orci lobortis augue scelerisque mollis. Phasellus libero mauris, aliquam eu, accumsan sed, facilisis vitae, orci. Phasellus",4/8/2024 17:49,Draft
1085,9,nulla. Cras,"est. Nunc laoreet lectus quis massa. Mauris vestibulum, neque sed dictum eleifend, nunc risus varius orci, in consequat enim diam vel",5/17/2023 5:54,Published
1178,15,odio a,"nibh. Donec est mauris, rhoncus id, mollis nec, cursus a, enim. Suspendisse aliquet, sem ut cursus luctus, ipsum leo elementum sem, vitae",5/16/2023 16:54,Published
1122,24,"nostra, per","placerat. Cras dictum ultricies ligula. Nullam enim. Sed nulla ante,",7/8/2023 14:00,Published
1127,21,per inceptos,"tellus. Suspendisse sed dolor. Fusce mi lorem, vehicula et, rutrum eu, ultrices sit amet, risus. Donec nibh enim, gravida sit",11/22/2023 5:33,Draft
1213,36,sed orci,"a feugiat tellus lorem eu metus. In lorem. Donec elementum, lorem ut aliquam iaculis, lacus pede",12/4/2023 0:11,Published
1143,36,blandit viverra.,"vitae velit egestas lacinia. Sed congue, elit sed consequat auctor, nunc nulla vulputate dui, nec tempus mauris",7/6/2023 16:42,Published
1000,17,"libero est,","sed, hendrerit a, arcu. Sed et libero. Proin mi. Aliquam gravida mauris ut mi. Duis risus odio, auctor vitae, aliquet nec, imperdiet nec,",6/10/2023 18:27,Draft
1287,11,massa non,"malesuada fringilla est. Mauris eu turpis. Nulla aliquet. Proin velit. Sed malesuada augue ut lacus. Nulla tincidunt, neque vitae semper egestas, urna",2/1/2024 2:08,Draft
1318,3,"cursus et,","vehicula aliquet libero. Integer in magna. Phasellus dolor elit, pellentesque a, facilisis non, bibendum sed, est. Nunc laoreet lectus quis massa. Mauris",6/24/2023 8:41,Draft
1006,27,Aenean euismod,"imperdiet ullamcorper. Duis at lacus. Quisque purus sapien, gravida non, sollicitudin a, malesuada id, erat. Etiam vestibulum massa rutrum magna. Cras convallis convallis",1/24/2024 4:17,Draft
1274,35,neque venenatis,in faucibus orci luctus et ultrices posuere cubilia Curae Donec tincidunt. Donec vitae erat vel pede blandit congue. In scelerisque scelerisque dui.,11/16/2023 21:58,Published
1188,22,"luctus, ipsum","nisi magna sed dui. Fusce aliquam, enim nec tempus scelerisque, lorem ipsum sodales purus, in molestie tortor nibh",2/7/2024 4:30,Published
1234,3,ac orci.,"Sed nunc est, mollis non, cursus non, egestas a, dui. Cras pellentesque. Sed dictum. Proin eget odio. Aliquam",8/23/2023 0:54,Published
1376,8,"est mauris,",In condimentum. Donec at arcu. Vestibulum ante ipsum primis in faucibus orci luctus et ultrices,9/30/2023 19:21,Published
1140,17,"tempor, est","non, feugiat nec, diam. Duis mi enim, condimentum eget, volutpat ornare, facilisis eget, ipsum. Donec sollicitudin adipiscing ligula. Aenean gravida nunc sed pede.",6/5/2023 7:01,Published
1216,20,semper. Nam,"imperdiet dictum magna. Ut tincidunt orci quis lectus. Nullam suscipit, est ac facilisis facilisis, magna tellus faucibus leo, in lobortis tellus",7/30/2023 18:29,Published
1329,13,tincidunt tempus,fringilla est. Mauris eu turpis. Nulla aliquet. Proin velit. Sed,1/11/2024 12:05,Published
1168,23,nec ipsum.,facilisi. Sed neque. Sed eget lacus. Mauris non dui nec urna suscipit nonummy. Fusce fermentum fermentum arcu. Vestibulum ante ipsum primis in faucibus orci,3/5/2024 19:18,Draft
1009,33,dis parturient,"Vivamus euismod urna. Nullam lobortis quam a felis ullamcorper viverra. Maecenas iaculis aliquet diam. Sed diam lorem, auctor quis, tristique ac,",11/18/2023 4:06,Draft
1027,30,eget ipsum.,"neque venenatis lacus. Etiam bibendum fermentum metus. Aenean sed pede nec ante blandit viverra. Donec tempus, lorem fringilla ornare placerat, orci lacus vestibulum lorem, sit",10/29/2023 19:35,Draft
1292,19,at augue,"odio tristique pharetra. Quisque ac libero nec ligula consectetuer rhoncus. Nullam velit dui, semper et, lacinia vitae, sodales at, velit. Pellentesque ultricies",7/14/2023 10:26,Draft
1119,26,tortor nibh,eget ipsum. Suspendisse sagittis. Nullam vitae diam. Proin dolor. Nulla semper tellus id nunc interdum feugiat. Sed nec metus,10/21/2023 10:56,Draft
1193,35,dolor dapibus,"dui. Fusce diam nunc, ullamcorper eu, euismod ac, fermentum vel, mauris. Integer sem elit, pharetra ut, pharetra sed, hendrerit a, arcu.",5/17/2023 3:03,Published
1261,17,lorem ipsum,velit. Aliquam nisl. Nulla eu neque pellentesque massa lobortis ultrices. Vivamus rhoncus. Donec est. Nunc,1/25/2024 23:06,Published
1382,30,"dolor, nonummy",a neque. Nullam ut nisi a odio semper cursus. Integer mollis. Integer tincidunt aliquam arcu. Aliquam ultrices iaculis,10/31/2023 1:17,Draft
1306,38,facilisis. Suspendisse,nulla. In tincidunt congue turpis. In condimentum. Donec at arcu. Vestibulum ante ipsum primis in faucibus orci,12/8/2023 0:16,Draft
1032,11,gravida mauris,"consequat purus. Maecenas libero est, congue a, aliquet vel, vulputate eu, odio. Phasellus at augue id ante dictum cursus. Nunc mauris",10/26/2023 7:38,Published
1042,38,Curabitur vel,nisi. Mauris nulla. Integer urna. Vivamus molestie dapibus ligula. Aliquam erat volutpat. Nulla dignissim. Maecenas ornare egestas ligula. Nullam,7/1/2023 6:32,Published
1099,5,"accumsan sed,","tellus faucibus leo, in lobortis tellus justo sit amet nulla. Donec non justo. Proin non massa non ante bibendum ullamcorper. Duis cursus, diam",12/7/2023 18:33,Published
1132,9,eget lacus.,"Donec egestas. Aliquam nec enim. Nunc ut erat. Sed nunc est, mollis non, cursus non, egestas a, dui. Cras pellentesque.",3/29/2024 2:30,Draft
1194,15,eu erat,dignissim pharetra. Nam ac nulla. In tincidunt congue turpis. In condimentum. Donec at arcu. Vestibulum ante ipsum primis,12/29/2023 19:01,Published
1184,38,"tincidunt, nunc","eu, ultrices sit amet, risus. Donec nibh enim, gravida sit amet, dapibus id,",9/29/2023 5:09,Published
1068,35,ipsum non,nec mauris blandit mattis. Cras eget nisi dictum augue malesuada malesuada. Integer id,2/7/2024 14:42,Draft
1053,20,"pharetra ut,","non, lacinia at, iaculis quis, pede. Praesent eu dui. Cum sociis natoque penatibus et",11/19/2023 10:45,Published
1140,14,tempor arcu.,dictum. Proin eget odio. Aliquam vulputate ullamcorper magna. Sed eu eros. Nam consequat dolor vitae,6/29/2023 10:59,Draft
1127,31,congue turpis.,"at, iaculis quis, pede. Praesent eu dui. Cum sociis natoque penatibus et magnis dis parturient montes, nascetur ridiculus mus. Aenean eget",12/3/2023 2:02,Draft
1259,4,nec metus,"malesuada augue ut lacus. Nulla tincidunt, neque vitae semper egestas, urna justo faucibus lectus, a",8/2/2023 21:14,Draft
1267,23,"dolor dolor,",nonummy ipsum non arcu. Vivamus sit amet risus. Donec egestas. Aliquam nec,1/12/2024 4:10,Draft
1300,9,"non, vestibulum","sociis natoque penatibus et magnis dis parturient montes, nascetur ridiculus mus. Proin vel nisl. Quisque fringilla euismod enim. Etiam gravida molestie arcu.",2/25/2024 11:09,Published
1009,30,"nec, mollis","tincidunt nibh. Phasellus nulla. Integer vulputate, risus a ultricies adipiscing, enim mi tempor lorem, eget mollis lectus pede",9/2/2023 3:10,Draft
1363,21,feugiat placerat,"sollicitudin adipiscing ligula. Aenean gravida nunc sed pede. Cum sociis natoque penatibus et magnis dis parturient montes, nascetur ridiculus mus. Proin",8/3/2023 5:59,Draft
1173,23,Nam interdum,"convallis erat, eget tincidunt dui augue eu tellus. Phasellus elit pede, malesuada vel, venenatis vel, faucibus id, libero. Donec consectetuer mauris id sapien.",4/2/2024 19:40,Draft
1132,29,Nullam feugiat,"luctus lobortis. Class aptent taciti sociosqu ad litora torquent per conubia nostra,",5/20/2023 11:01,Published
1239,23,elit. Etiam,"sem ut cursus luctus, ipsum leo elementum sem, vitae aliquam eros turpis non enim. Mauris quis turpis vitae purus gravida sagittis. Duis gravida.",5/8/2023 13:59,Published
1107,2,"mi, ac","vestibulum nec, euismod in, dolor. Fusce feugiat. Lorem ipsum dolor sit amet, consectetuer adipiscing elit. Aliquam auctor, velit eget laoreet posuere, enim",9/9/2023 3:42,Draft
